[
  {
    "name": "momo-tools",
    "type": "plugin",
    "trigger": ["capability router", "tool routing", "which tool", "dashboard", "audit tools"],
    "scope": "local capability index",
    "path_or_tool": "plugin/scripts/momo-tools",
    "risk": ["read-only"],
    "source": "public example",
    "owner": "local user",
    "version": "0.1.0-public",
    "last_verified": "2026-07-08",
    "verification_level": "verified-working",
    "known_caveats": ["Example index only. Replace with your own local capabilities."],
    "canonical_for": ["capability routing", "risk gates", "verification dashboard"],
    "workflow_shape": "index -> route -> gates -> evidence"
  },
  {
    "name": "document-reader",
    "type": "skill",
    "trigger": ["pdf", "docx", "spreadsheet", "document", "summarize file", "extract table"],
    "scope": "local documents",
    "path_or_tool": "skills/document-reader/SKILL.md",
    "risk": ["read-only", "local-file"],
    "source": "example",
    "owner": "local user",
    "version": "example",
    "last_verified": "not-verified",
    "verification_level": "visible",
    "known_caveats": ["Does not prove parser availability or OCR quality."],
    "canonical_for": ["document analysis", "file summary"],
    "workflow_shape": "convert -> inspect -> summarize"
  },
  {
    "name": "browser-research",
    "type": "connector",
    "trigger": ["latest", "current", "today", "website", "browse", "web research", "verify online"],
    "scope": "external web",
    "path_or_tool": "browser/search tool",
    "risk": ["external-network"],
    "source": "example",
    "owner": "local user",
    "version": "example",
    "last_verified": "not-verified",
    "verification_level": "visible",
    "known_caveats": ["Should not be used when the user explicitly says not to browse."],
    "canonical_for": ["current information", "official source lookup"],
    "workflow_shape": "search -> open primary sources -> cite"
  },
  {
    "name": "repo-review",
    "type": "skill",
    "trigger": ["review code", "bug risk", "security audit", "release check", "regression"],
    "scope": "local repository",
    "path_or_tool": "skills/repo-review/SKILL.md",
    "risk": ["read-only", "local-file"],
    "source": "example",
    "owner": "local user",
    "version": "example",
    "last_verified": "not-verified",
    "verification_level": "visible",
    "known_caveats": ["Review does not imply tests have been run."],
    "canonical_for": ["code review", "release risk"],
    "workflow_shape": "inspect diff -> findings -> tests"
  },
  {
    "name": "email-triage",
    "type": "connector",
    "trigger": ["email", "inbox", "draft reply", "mail", "message thread"],
    "scope": "private account",
    "path_or_tool": "email connector",
    "risk": ["private-data", "external-network", "write"],
    "source": "example",
    "owner": "local user",
    "version": "example",
    "last_verified": "not-verified",
    "verification_level": "visible",
    "known_caveats": ["Drafting, archiving, deleting, or sending requires explicit approval."],
    "canonical_for": ["email search", "email draft"],
    "workflow_shape": "search -> read bounded thread -> draft with approval"
  },
  {
    "name": "memory-capture",
    "type": "workflow",
    "trigger": ["remember this", "save this", "capture note", "write to knowledge base"],
    "scope": "local knowledge base",
    "path_or_tool": "local memory workflow",
    "risk": ["write", "private-data"],
    "source": "example",
    "owner": "local user",
    "version": "example",
    "last_verified": "not-verified",
    "verification_level": "visible",
    "known_caveats": ["Must not run when the user says do not save."],
    "canonical_for": ["knowledge capture", "project memory"],
    "workflow_shape": "summarize -> redact -> append"
  },
  {
    "name": "frontend-qa",
    "type": "workflow",
    "trigger": ["ui bug", "responsive", "screenshot", "frontend", "visual qa", "layout"],
    "scope": "local app",
    "path_or_tool": "browser automation or local preview",
    "risk": ["write", "local-app"],
    "source": "example",
    "owner": "local user",
    "version": "example",
    "last_verified": "not-verified",
    "verification_level": "visible",
    "known_caveats": ["Should not inspect unrelated browser profiles or logged-in pages."],
    "canonical_for": ["frontend testing", "visual regression"],
    "workflow_shape": "run preview -> screenshot -> inspect -> patch -> retest"
  },
  {
    "name": "data-analysis",
    "type": "workflow",
    "trigger": ["csv", "metrics", "dashboard", "chart", "kpi", "analysis"],
    "scope": "bounded data",
    "path_or_tool": "data analysis runtime",
    "risk": ["local-file", "write"],
    "source": "example",
    "owner": "local user",
    "version": "example",
    "last_verified": "not-verified",
    "verification_level": "visible",
    "known_caveats": ["Private or production data requires a separate data boundary."],
    "canonical_for": ["data analysis", "dashboard"],
    "workflow_shape": "load bounded data -> validate -> analyze -> visualize"
  }
]

